{
  "schemaVersion": 1,
  "organizationID": "synthetic-company",
  "revision": 1,
  "owner": "synthetic-admin",
  "timeZone": "Asia/Ho_Chi_Minh",
  "employees": [{
    "employeeID": "synthetic-employee",
    "googleAccountKeys": ["0000000000000000000000000000000000000000000000000000000000000000"],
    "recipients": ["manager@example.test"],
    "driveFolderIDs": ["synthetic-folder-id"]
  }],
  "allowGmail": true,
  "allowDrive": true,
  "allowScheduledDelivery": false,
  "allowNarrativeExport": false,
  "retentionDays": 90,
  "effectiveFrom": "2026-09-06T00:00:00.000Z",
  "expiresAt": "2026-12-31T00:00:00.000Z"
}
